{
  "schema_version": "1.0",
  "kind": "component-mechanical-profile",
  "component_id": "idmd-0021-starcore-oled-1-3",
  "hardware_id": "IDMD-0021",
  "name": "IDMD-0021 星核板 1.3 英寸 OLED",
  "units": "mm",
  "coordinate_system": {"origin": "PCB outline center", "x_positive": "right", "y_positive": "up"},
  "outline": {"shape": "rectangle", "width": 55.283, "depth": 30.255, "status": "source_reviewed"},
  "mounting": {
    "status": "source_reviewed",
    "pattern_x": 45,
    "pattern_y": 20,
    "holes": [
      {"x": -22.5, "y": -10, "status": "source_reviewed"},
      {"x": 22.5, "y": -10, "status": "source_reviewed"},
      {"x": 22.5, "y": 10, "status": "source_reviewed"},
      {"x": -22.5, "y": 10, "status": "source_reviewed"}
    ],
    "fastener_class": "M3",
    "hole_diameter_status": "requires_measurement"
  },
  "panel_features": [
    {"id": "display-window", "purpose": "panel_cutout", "status": "source_reviewed", "availability": "available", "shape": "rect", "center": [0, 0], "size": [37, 25], "note": "Nominal display window; bezel height, viewing angle, and cable clearance remain physically unverified."}
  ],
  "source_ids": ["starcore-module-catalog-snapshot", "starcore-mechanical-facts-snapshot"],
  "verification": {"source_reviewed": {"status": "verified", "checked_at": "2026-08-17", "evidence_level": "sanitized_internal_source"}, "physical_fit": "unverified"}
}
