{
  "schema_version": "1.0",
  "kind": "component-mechanical-profile",
  "component_id": "idmd-0001-starcore-rgb-light",
  "hardware_id": "IDMD-0001",
  "name": "IDMD-0001 星核板三通道 RGB 灯",
  "units": "mm",
  "coordinate_system": {"origin": "PCB outline center", "x_positive": "right", "y_positive": "up"},
  "outline": {"shape": "rectangle", "width": 30, "depth": 30, "status": "source_reviewed"},
  "mounting": {
    "status": "source_reviewed",
    "pattern_x": 20,
    "pattern_y": 20,
    "holes": [
      {"x": -10, "y": -10, "status": "source_reviewed"},
      {"x": 10, "y": -10, "status": "source_reviewed"},
      {"x": 10, "y": 10, "status": "source_reviewed"},
      {"x": -10, "y": 10, "status": "source_reviewed"}
    ],
    "fastener_class": "M3",
    "hole_diameter_status": "requires_measurement"
  },
  "panel_features": [
    {"id": "rgb-light-clearance", "purpose": "functional_clearance", "status": "requires_measurement", "availability": "not_available", "note": "No trusted panel opening geometry is available; measure the actual light and desired viewing angle."}
  ],
  "source_ids": ["starcore-module-catalog-snapshot", "starcore-mechanical-facts-snapshot"],
  "verification": {"source_reviewed": {"status": "verified", "checked_at": "2026-08-17", "evidence_level": "sanitized_internal_source"}, "physical_fit": "unverified"}
}
